### ISSUE TITLE
failed to push buffer on src pad

### ISSUE THREAD

**Issue by chelaxe** [pkgs-cloud/kurento#13]
Centos 7

apache-openmeetings-5.0.1
Kurento Media Server version: 6.9.1~15.g0a5e285

WEB stream is not displayed.

log kms:
```
warning dtlsenc
gstdtlsenc.c:500 src_task_loop() <dtls-encoder>
failed to push buffer on src pad: not-linked
```

openmeetings:
Media server connection for user firstname lastname is failed, will try to re-connect

```
# netstat -tunapl | grep kurento
tcp        4      0 172.16.33.214:12005     0.0.0.0:*               LISTEN      952/kurento-media-s
tcp        0      0 172.16.33.214:51046     0.0.0.0:*               LISTEN      952/kurento-media-s
tcp6       0      0 :::8888                 :::*                    LISTEN      952/kurento-media-s
tcp6       0      0 fe80::21c:25ff:fe:61562 :::*                    LISTEN      952/kurento-media-s
tcp6       0      0 fe80::21c:25ff:fe:32956 :::*                    LISTEN      952/kurento-media-s
tcp6       0      0 127.0.0.1:8888          127.0.0.1:40062         ESTABLISHED 952/kurento-media-s
tcp6       0      0 127.0.0.1:8888          127.0.0.1:40048         ESTABLISHED 952/kurento-media-s
udp    60288      0 172.16.33.214:36174     0.0.0.0:*                           952/kurento-media-s
udp        0      0 172.16.33.214:12986     0.0.0.0:*                           952/kurento-media-s
udp6       0      0 fe80::21c:25ff:fe:40804 :::*                                952/kurento-media-s
udp6       0      0 fe80::21c:25ff:feb:5068 :::*                                952/kurento-media-s
```

```
172.16.33.100.49294 > 172.16.33.214.36174: UDP, length 100
172.16.33.100.62913 > 172.16.33.214.dbisamserver1: Flags [P.], seq 5611:5713, ack 1, win 1026, length 102
172.16.33.214.dbisamserver1 > 172.16.33.100.62913: Flags [.], ack 5713, win 229, length 0
172.16.33.100.49294 > 172.16.33.214.36174: UDP, length 100
172.16.33.100.62913 > 172.16.33.214.dbisamserver1: Flags [P.], seq 5713:5815, ack 1, win 1026, length 102
172.16.33.214.dbisamserver1 > 172.16.33.100.62913: Flags [.], ack 5815, win 229, length 0
172.16.33.100.49294 > 172.16.33.214.36174: UDP, length 100
172.16.33.100.62913 > 172.16.33.214.dbisamserver1: Flags [P.], seq 5815:5917, ack 1, win 1026, length 102
172.16.33.214.dbisamserver1 > 172.16.33.100.62913: Flags [.], ack 5917, win 229, length 0
172.16.33.100.49294 > 172.16.33.214.36174: UDP, length 100
172.16.33.100.62913 > 172.16.33.214.dbisamserver1: Flags [P.], seq 5917:6019, ack 1, win 1026, length 102
172.16.33.214.dbisamserver1 > 172.16.33.100.62913: Flags [.], ack 6019, win 229, length 0
172.16.33.100.49294 > 172.16.33.214.36174: UDP, length 100
172.16.33.100.62913 > 172.16.33.214.dbisamserver1: Flags [P.], seq 6019:6121, ack 1, win 1026, length 102
172.16.33.214.dbisamserver1 > 172.16.33.100.62913: Flags [.], ack 6121, win 229, length 0
172.16.33.100.49294 > 172.16.33.214.36174: UDP, length 100
172.16.33.100.62913 > 172.16.33.214.dbisamserver1: Flags [P.], seq 6121:6223, ack 1, win 1026, length 102
172.16.33.214.dbisamserver1 > 172.16.33.100.62913: Flags [.], ack 6223, win 229, length 0
172.16.33.100.49294 > 172.16.33.214.36174: UDP, length 100
172.16.33.100.62913 > 172.16.33.214.dbisamserver1: Flags [P.], seq 6223:6325, ack 1, win 1026, length 102
172.16.33.100.62913 > 172.16.33.214.dbisamserver1: Flags [F.], seq 6325, ack 1, win 1026, length 0
172.16.33.214.dbisamserver1 > 172.16.33.100.62913: Flags [.], ack 6326, win 229, length 0
```

Help me.

**Comment by chelaxe** [comment]
here's another

```
debug dtlsdec                   gstdtlsdec.c:650 get_agent_by_pem() <GstDtlsAgent@0x7fbe18057f90>  no agent found, created new  

debug GST_CLOCK                 gstsystemclock.c:363 gst_system_clock_obtain()  returning static system clock  

error glib                      GLib-GObject:0 ()  g_object_set: assertion 'G_IS_OBJECT (object)' failed  

error glib                      GLib-GObject:0 ()  g_object_set: assertion 'G_IS_OBJECT (object)' failed  

debug GST_PADS                  gstelement.c:1028 gst_element_get_request_pad()  comparing send_rtp_sink_0 to recv_rtp_sink_%u  

debug GST_PADS                  gstelement.c:1028 gst_element_get_request_pad()  comparing send_rtp_sink_0 to recv_rtcp_sink_%u  

```

**Comment by chelaxe** [comment]
```
warning dtlsenc                   gstdtlsenc.c:500 src_task_loop() <dtls-encoder>  failed to push buffer on src pad: not-linked  

warning kmsicecandidate           kmsicecandidate.c:107 kms_ice_candidate_update_values() <KmsIceCandidate@0x56071c3e3a00>  Cannot parse from 'candidate:3358797483 1 udp 2113937151 7baeedbe-4538-4313-9084-238c6d4f70f8.local 59642 typ host generation 0 ufrag SVPC network-cost 999'
```
